{
  "schemaVersion": "1.0.0",
  "inputId": "birth-input-missing-time",
  "calendar": "gregorian",
  "date": "2000-01-02",
  "time": { "reason": "unknown" },
  "place": "Beijing",
  "timeZone": "Asia/Shanghai",
  "ruleSexMarker": "unspecified",
  "source": {
    "sourceId": "user-form",
    "version": "1.0.0",
    "kind": "user_provided"
  },
  "confirmation": "confirmed"
}
