{
  "schemaVersion": "1.0.0",
  "inputId": "birth-input-boundary-date",
  "calendar": "gregorian",
  "date": "0001-01-01",
  "time": "00:00",
  "place": { "reason": "not_provided" },
  "timeZone": { "reason": "unknown" },
  "ruleSexMarker": "unspecified",
  "source": {
    "sourceId": "boundary-fixture",
    "version": "1.0.0",
    "kind": "user_provided"
  },
  "confirmation": "unconfirmed"
}
